{
  "kind": "dream_context",
  "schema_version": "2.1",
  "run": {
    "id": "run-11111111-1111-4111-8111-111111111111",
    "scope": "workspace:example",
    "idempotency_key": "workspace:example:2026-07-18T00:00:00Z:2.1",
    "horizon": { "start": "2026-07-17T00:00:00Z", "end": "2026-07-18T00:00:00Z", "timezone": "Asia/Shanghai" },
    "cursor_before": null,
    "known_state": { "signals": 0, "topics": 0, "evidence": 0 }
  },
  "input_manifest": [
    { "id": "window:2026-07-17", "type": "window_summary", "repository": "*", "ref": "window:2026-07-17", "content_hash": "aaaaaaaaaaaaaaaaaaaaaaaaaaaaaaaaaaaaaaaaaaaaaaaaaaaaaaaaaaaaaaaa" }
  ],
  "evidence_catalog": [
    { "id": "ev-fff1024131eff094", "source_key": "github:github.com/example/vigil:commit:abc123", "type": "commit", "tier": 1, "directness": "direct", "repository": "example/vigil@main", "observed_at": "2026-07-17T12:00:00Z", "locator": "commit:abc123", "claim": "The commit introduces a persistent Dream ledger.", "excerpt": "Add the Dream ledger and append-only revisions.", "content_hash": "aaaaaaaaaaaaaaaaaaaaaaaaaaaaaaaaaaaaaaaaaaaaaaaaaaaaaaaaaaaaaaaa", "provenance_group": "commit:abc123", "independence_group": "commit:abc123", "canonical": true, "duplicate_of": null, "truncated": false },
    { "id": "ev-b1af23d8da3c900c", "source_key": "github:github.com/example/vigil:check:ci-42", "type": "test", "tier": 1, "directness": "direct", "repository": "example/vigil@main", "observed_at": "2026-07-17T12:10:00Z", "locator": "check:ci-42", "claim": "The store transaction tests pass for the change.", "excerpt": "Dream ledger transaction suite: success.", "content_hash": "bbbbbbbbbbbbbbbbbbbbbbbbbbbbbbbbbbbbbbbbbbbbbbbbbbbbbbbbbbbbbbbb", "provenance_group": "check:ci-42", "independence_group": "check:ci-42", "canonical": true, "duplicate_of": null, "truncated": false }
  ],
  "known_state": { "signals": [], "topics": [], "forecasts": [] },
  "issued_ids": {
    "candidates": ["cand-22222222-2222-4222-8222-222222222222"],
    "signals": ["sig-33333333-3333-4333-8333-333333333333"],
    "signal_changes": ["schg-44444444-4444-4444-8444-444444444444"],
    "signal_revisions": ["srev-55555555-5555-4555-8555-555555555555"],
    "topics": ["top-66666666-6666-4666-8666-666666666666"],
    "topic_changes": ["tchg-77777777-7777-4777-8777-777777777777"],
    "topic_revisions": ["trev-88888888-8888-4888-8888-888888888888"],
    "forecasts": ["fc-99999999-9999-4999-8999-999999999999"],
    "forecast_evaluations": ["fce-aaaaaaaa-aaaa-4aaa-8aaa-aaaaaaaaaaaa"],
    "suppression_groups": ["sg-bbbbbbbb-bbbb-4bbb-8bbb-bbbbbbbbbbbb"]
  },
  "limits": { "max_signal_changes": 1, "max_topic_changes": 1 },
  "context_hash": "2f01d80e6805157cd41e9e9159c6caa2de7304458f0443590ec7cf354144adaf"
}
